{
  "schema": "longrun-return/v1",
  "work_id": "BI-01",
  "invocation_id": "BI01-CO-01-R0017-e26bceee07",
  "assignment_token": "2c20b38cdd23246dbaf1ddd67bcdb422",
  "question_work_ref": "github:daowei2026/observe-iterate@4c1d231227107a180efe102c30aeefd321136a92:runs/BI-01-CO-01/provenance/turns/R0017/QUESTION_WORK_RETURN.json::full",
  "work_status": "SUBMITTED",
  "completed_scope_ref": "github:daowei2026/observe-iterate@ec669f4ef1764a6da43a1b9d76cd725d0b260bcd:runs/BI-01-CO-01/provenance/turns/R0017/FULL_RESPONSE.md::#completed",
  "remaining_scope_ref": "github:daowei2026/observe-iterate@ec669f4ef1764a6da43a1b9d76cd725d0b260bcd:runs/BI-01-CO-01/provenance/turns/R0017/FULL_RESPONSE.md::#remaining",
  "artifact_refs": [
    {
      "repo": "daowei2026/observe-iterate",
      "commit": "ec669f4ef1764a6da43a1b9d76cd725d0b260bcd",
      "path": "runs/BI-01-CO-01/provenance/turns/R0017/FULL_RESPONSE.md"
    },
    {
      "repo": "daowei2026/observe-iterate",
      "commit": "2d5d94107c2cb6731e149a389280cc9fb1f887b4",
      "path": "runs/BI-01-CO-01/reviews/management-R0017/DECISION.md"
    },
    {
      "repo": "daowei2026/observe-iterate",
      "commit": "4d490ebd0e5828be2cfdf96de84956cd215817e0",
      "path": "runs/BI-01-CO-01/README.md"
    },
    {
      "repo": "daowei2026/observe-iterate",
      "commit": "4d490ebd0e5828be2cfdf96de84956cd215817e0",
      "path": "runs/BI-01-CO-01/00_长程推进地图.md"
    },
    {
      "repo": "daowei2026/observe-iterate",
      "commit": "4d490ebd0e5828be2cfdf96de84956cd215817e0",
      "path": "runs/BI-01-CO-01/artifacts/batch-01/OWNER_REVIEW.md"
    },
    {
      "repo": "daowei2026/observe-iterate",
      "commit": "4d490ebd0e5828be2cfdf96de84956cd215817e0",
      "path": "runtime/config/WORKMAP_BINDING.json"
    },
    {
      "repo": "daowei2026/observe-iterate",
      "commit": "4c1d231227107a180efe102c30aeefd321136a92",
      "path": "runs/BI-01-CO-01/provenance/turns/R0017/QUESTION_WORK_RETURN.json"
    }
  ],
  "delivery": {
    "status": "READY",
    "missing_refs": []
  },
  "materials": {
    "use_record_ref": "github:daowei2026/observe-iterate@ec669f4ef1764a6da43a1b9d76cd725d0b260bcd:runs/BI-01-CO-01/provenance/turns/R0017/FULL_RESPONSE.md::#material-use",
    "unread_required": [],
    "unavailable_required": []
  },
  "handoff": {
    "kind": "SUBMIT",
    "route_key": "accept",
    "instructions_ref": "github:daowei2026/observe-iterate@ec669f4ef1764a6da43a1b9d76cd725d0b260bcd:runs/BI-01-CO-01/provenance/turns/R0017/FULL_RESPONSE.md::#continuation"
  },
  "role_outputs": {
    "management": {
      "decision_ref": "github:daowei2026/observe-iterate@2d5d94107c2cb6731e149a389280cc9fb1f887b4:runs/BI-01-CO-01/reviews/management-R0017/DECISION.md::#decision",
      "plan_ref": "github:daowei2026/observe-iterate@2d5d94107c2cb6731e149a389280cc9fb1f887b4:runs/BI-01-CO-01/reviews/management-R0017/DECISION.md::#plan",
      "issued_work_refs": [],
      "delivery_scope_ref": "github:daowei2026/observe-iterate@2d5d94107c2cb6731e149a389280cc9fb1f887b4:runs/BI-01-CO-01/reviews/management-R0017/DECISION.md::#delivery-scope"
    }
  }
}
