{
  "schema": "longrun-return/v1",
  "work_id": "BI-01",
  "invocation_id": "BI01-FO-01-R0025-20261024T015010Z-09839206",
  "assignment_token": "BI01-FO-01-N-W07-M24-CONSUME-2631db6d7b65439a81d6b8d4329a4200",
  "question_work_ref": "daowei2026/observe-iterate@f6827b112be12b0fcc5321fa3598b0ab35669f76:runs/BI-01-FO-01/artifacts/professional-R0025/QUESTION_WORK_RETURN.json::full",
  "work_status": "WAITING_INPUT",
  "completed_scope_ref": "daowei2026/observe-iterate@617958eb11c1096f437e5b54cae92281860b346b:runs/BI-01-FO-01/artifacts/professional-R0025/FULL_RESPONSE.md#completed",
  "remaining_scope_ref": "daowei2026/observe-iterate@617958eb11c1096f437e5b54cae92281860b346b:runs/BI-01-FO-01/artifacts/professional-R0025/FULL_RESPONSE.md#continuation",
  "artifact_refs": [
    {
      "repo": "daowei2026/observe-iterate",
      "commit": "617958eb11c1096f437e5b54cae92281860b346b",
      "path": "runs/BI-01-FO-01/artifacts/professional-R0025/FULL_RESPONSE.md"
    }
  ],
  "delivery": {
    "status": "READY",
    "missing_refs": []
  },
  "materials": {
    "use_record_ref": "daowei2026/observe-iterate@617958eb11c1096f437e5b54cae92281860b346b:runs/BI-01-FO-01/artifacts/professional-R0025/FULL_RESPONSE.md#source-use",
    "unread_required": [],
    "unavailable_required": [
      "正常平台6128/6129/6130/6131的目标图层恢复和必要交互证据尚未取得；最后真实W07打开记录均HTTP500、目标Bokeh document为0。本轮未亲自打开或看像素，新进程模型和已到board数据不能替代正常前端。",
      "M24既有platform-handoff所请求的原有权部署责任/授权及真实正常服务恢复输入尚无新增可用证据；协调责任仍在BI01-FO01-管理及Owner/原平台责任者，本Pro不预授共享部署或认证写权。已完成的W07数据消费不因此撤回，无依赖合法工作不被一并冻结。"
    ]
  },
  "handoff": {
    "kind": "WAIT",
    "route_key": "same_work",
    "instructions_ref": "daowei2026/observe-iterate@617958eb11c1096f437e5b54cae92281860b346b:runs/BI-01-FO-01/artifacts/professional-R0025/FULL_RESPONSE.md#continuation"
  },
  "role_outputs": {
    "professional": {
      "mode": "FEATURE_OBSERVATION",
      "result_ref": "daowei2026/observe-iterate@617958eb11c1096f437e5b54cae92281860b346b:runs/BI-01-FO-01/artifacts/professional-R0025/FULL_RESPONSE.md#result",
      "continuation_ref": "daowei2026/observe-iterate@617958eb11c1096f437e5b54cae92281860b346b:runs/BI-01-FO-01/artifacts/professional-R0025/FULL_RESPONSE.md#continuation"
    }
  }
}
