{
  "schema": "longrun-return/v1",
  "work_id": "BI-01",
  "invocation_id": "BI01-FO-01-R0026-20261024T103404Z-dc2099ae",
  "assignment_token": "BI01-FO-01-M-OWNER-CHANGE-09ad230071834a8f85ce08fdab6057bf",
  "question_work_ref": "github:daowei2026/observe-iterate@523c800cf2730c1a82bae2681eb5b21688425d37:runs/BI-01-FO-01/reviews/management-R0026/QUESTION_WORK_RETURN.json::full",
  "work_status": "IN_PROGRESS",
  "completed_scope_ref": "github:daowei2026/observe-iterate@9862ca3f75151491831b343ba520acbe680f6e42:runs/BI-01-FO-01/reviews/management-R0026/FULL_RESPONSE.md::#completed",
  "remaining_scope_ref": "github:daowei2026/observe-iterate@9862ca3f75151491831b343ba520acbe680f6e42:runs/BI-01-FO-01/reviews/management-R0026/FULL_RESPONSE.md::#remaining",
  "artifact_refs": [
    {
      "repo": "daowei2026/observe-iterate",
      "commit": "9862ca3f75151491831b343ba520acbe680f6e42",
      "path": "runs/BI-01-FO-01/reviews/management-R0026/FULL_RESPONSE.md"
    },
    {
      "repo": "daowei2026/observe-iterate",
      "commit": "3f8bb3e42a4b4e46ac623adac37a5aadff51a45e",
      "path": "runs/BI-01-FO-01/01_当前任务.md"
    },
    {
      "repo": "daowei2026/observe-iterate",
      "commit": "c2dc2851fc25cf4d5153165e22445bacb6b2b933",
      "path": "runs/BI-01-FO-01/00_长程推进地图.md"
    },
    {
      "repo": "daowei2026/observe-iterate",
      "commit": "090f594ef5db87733f006eae2675afcca0304cc4",
      "path": "runs/BI-01-FO-01/README.md"
    },
    {
      "repo": "daowei2026/observe-iterate",
      "commit": "fd3c7cff9a8e99c3ff484306bb4cf72f6b11f686",
      "path": "runtime/config/WORKMAP_BINDING.json"
    },
    {
      "repo": "daowei2026/observe-iterate",
      "commit": "523c800cf2730c1a82bae2681eb5b21688425d37",
      "path": "runs/BI-01-FO-01/reviews/management-R0026/QUESTION_WORK_RETURN.json"
    }
  ],
  "delivery": {
    "status": "READY",
    "missing_refs": []
  },
  "materials": {
    "use_record_ref": "github:daowei2026/observe-iterate@9862ca3f75151491831b343ba520acbe680f6e42:runs/BI-01-FO-01/reviews/management-R0026/FULL_RESPONSE.md::#source-use",
    "unread_required": [],
    "unavailable_required": []
  },
  "handoff": {
    "kind": "CONTINUE",
    "route_key": "same_work",
    "instructions_ref": "github:daowei2026/observe-iterate@9862ca3f75151491831b343ba520acbe680f6e42:runs/BI-01-FO-01/reviews/management-R0026/FULL_RESPONSE.md::#continuation"
  },
  "role_outputs": {
    "management": {
      "decision_ref": "github:daowei2026/observe-iterate@9862ca3f75151491831b343ba520acbe680f6e42:runs/BI-01-FO-01/reviews/management-R0026/FULL_RESPONSE.md::#decision",
      "plan_ref": "github:daowei2026/observe-iterate@9862ca3f75151491831b343ba520acbe680f6e42:runs/BI-01-FO-01/reviews/management-R0026/FULL_RESPONSE.md::#plan",
      "issued_work_refs": [
        "github:daowei2026/observe-iterate@3f8bb3e42a4b4e46ac623adac37a5aadff51a45e:runs/BI-01-FO-01/01_当前任务.md::full",
        "github:daowei2026/observe-iterate@9862ca3f75151491831b343ba520acbe680f6e42:runs/BI-01-FO-01/reviews/management-R0026/FULL_RESPONSE.md::#next-professional"
      ],
      "delivery_scope_ref": "github:daowei2026/observe-iterate@9862ca3f75151491831b343ba520acbe680f6e42:runs/BI-01-FO-01/reviews/management-R0026/FULL_RESPONSE.md::#completed"
    }
  }
}
