{
  "schema": "longrun-return/v1",
  "work_id": "BI-01",
  "invocation_id": "BI01-RESTART-01-R0009-8a1bf0c117c9285bfec5f77b7a077a58",
  "assignment_token": "99a9ce9b6e7e4228f0a1e70e9794a14e",
  "question_work_ref": "github:daowei2026/observe-iterate@6f57a0d3d084fff620fbbcd05651c82f62dfa41b:runs/BI-01-RESTART-01/provenance/turns/R0009/QUESTION_WORK_RETURN.json::full",
  "work_status": "SUBMITTED",
  "completed_scope_ref": "github:daowei2026/observe-iterate@006e65e8ac6db6d218fe910d8e3ed11d57b1decc:runs/BI-01-RESTART-01/reviews/MANAGEMENT_OWNER_DECISION_AND_I6_START_R0009.md::#delivery-scope",
  "remaining_scope_ref": "github:daowei2026/observe-iterate@006e65e8ac6db6d218fe910d8e3ed11d57b1decc:runs/BI-01-RESTART-01/01_当前任务.md::full",
  "artifact_refs": [
    {
      "repo": "daowei2026/observe-iterate",
      "commit": "ed2868f7122b9bae5c73724a2930dcecf0835974",
      "path": "runs/BI-01-RESTART-01/OWNER_DECISION_RESPONSE_R0008.md"
    },
    {
      "repo": "daowei2026/observe-iterate",
      "commit": "006e65e8ac6db6d218fe910d8e3ed11d57b1decc",
      "path": "runs/BI-01-RESTART-01/reviews/MANAGEMENT_OWNER_DECISION_AND_I6_START_R0009.md"
    },
    {
      "repo": "daowei2026/observe-iterate",
      "commit": "006e65e8ac6db6d218fe910d8e3ed11d57b1decc",
      "path": "runs/BI-01-RESTART-01/00_长程推进地图.md"
    },
    {
      "repo": "daowei2026/observe-iterate",
      "commit": "006e65e8ac6db6d218fe910d8e3ed11d57b1decc",
      "path": "runs/BI-01-RESTART-01/01_当前任务.md"
    },
    {
      "repo": "daowei2026/observe-iterate",
      "commit": "fcf659ad53df868ca676335b6417a5c0444b11c1",
      "path": "runs/BI-01-RESTART-01/bindings/QUESTION_WORK_BINDING_I6.json"
    },
    {
      "repo": "daowei2026/observe-iterate",
      "commit": "fcf659ad53df868ca676335b6417a5c0444b11c1",
      "path": "runtime/config/WORKMAP_BINDING.json"
    },
    {
      "repo": "daowei2026/observe-iterate",
      "commit": "6f57a0d3d084fff620fbbcd05651c82f62dfa41b",
      "path": "runs/BI-01-RESTART-01/provenance/turns/R0009/QUESTION_WORK_RETURN.json"
    }
  ],
  "delivery": {
    "status": "READY",
    "missing_refs": []
  },
  "materials": {
    "use_record_ref": "github:daowei2026/observe-iterate@006e65e8ac6db6d218fe910d8e3ed11d57b1decc:runs/BI-01-RESTART-01/reviews/MANAGEMENT_OWNER_DECISION_AND_I6_START_R0009.md::#material-use",
    "unread_required": [],
    "unavailable_required": []
  },
  "handoff": {
    "kind": "SUBMIT",
    "route_key": "management_i6_start_to_coordinator",
    "instructions_ref": "github:daowei2026/observe-iterate@006e65e8ac6db6d218fe910d8e3ed11d57b1decc:runs/BI-01-RESTART-01/reviews/MANAGEMENT_OWNER_DECISION_AND_I6_START_R0009.md::#management-continuation"
  },
  "role_outputs": {
    "management": {
      "decision_ref": "github:daowei2026/observe-iterate@006e65e8ac6db6d218fe910d8e3ed11d57b1decc:runs/BI-01-RESTART-01/reviews/MANAGEMENT_OWNER_DECISION_AND_I6_START_R0009.md::#current",
      "plan_ref": "github:daowei2026/observe-iterate@006e65e8ac6db6d218fe910d8e3ed11d57b1decc:runs/BI-01-RESTART-01/00_长程推进地图.md::#next",
      "issued_work_refs": [
        "github:daowei2026/observe-iterate@006e65e8ac6db6d218fe910d8e3ed11d57b1decc:runs/BI-01-RESTART-01/01_当前任务.md::full",
        "github:daowei2026/observe-iterate@fcf659ad53df868ca676335b6417a5c0444b11c1:runs/BI-01-RESTART-01/bindings/QUESTION_WORK_BINDING_I6.json::full"
      ],
      "delivery_scope_ref": "github:daowei2026/observe-iterate@006e65e8ac6db6d218fe910d8e3ed11d57b1decc:runs/BI-01-RESTART-01/reviews/MANAGEMENT_OWNER_DECISION_AND_I6_START_R0009.md::#delivery-scope"
    }
  }
}
