{
  "schema": "longrun-return/v1",
  "work_id": "BI-01",
  "invocation_id": "BI01-V2-02-R0004-20261018T143706Z-4e789f60",
  "assignment_token": "BI01-V2-02-M-START-FORMAT-8e1a9756cfeb4576b703c9cac48fef9d",
  "question_work_ref": "#question-work-return",
  "work_status": "SUBMITTED",
  "completed_scope_ref": "#completed",
  "remaining_scope_ref": "#remaining",
  "artifact_refs": [
    {
      "repo": "daowei2026/observe-iterate",
      "commit": "af50358f6de756d56759bc004baacf7ed596a2d0",
      "path": "runs/BI-01-V2-02/reviews/management-R0004/DECISION.md"
    },
    {
      "repo": "daowei2026/observe-iterate",
      "commit": "4a4c8d9e1a6dd7726ed2147b49313c3fa17729c2",
      "path": "runs/BI-01-V2-02/reviews/management-R0001/READER_TASK.md"
    },
    {
      "repo": "daowei2026/observe-iterate",
      "commit": "485a796b1d709be81957f25851e62e8c56ddd688",
      "path": "runs/BI-01-V2-02/reviews/independent/WORKMAP_READER_R0001_INPUT.md"
    },
    {
      "answer_ref": "#validation"
    }
  ],
  "delivery": {
    "status": "READY",
    "missing_refs": []
  },
  "materials": {
    "use_record_ref": "#material-use",
    "unread_required": [],
    "unavailable_required": []
  },
  "handoff": {
    "kind": "SUBMIT",
    "route_key": "return_to_ref",
    "instructions_ref": "#continuation"
  },
  "role_outputs": {
    "management": {
      "decision_ref": "#management-decision",
      "plan_ref": "#plan",
      "issued_work_refs": [
        "daowei2026/observe-iterate@af50358f6de756d56759bc004baacf7ed596a2d0:runs/BI-01-V2-02/reviews/management-R0004/DECISION.md::#reader-pre-adoption",
        "daowei2026/observe-iterate@af50358f6de756d56759bc004baacf7ed596a2d0:runs/BI-01-V2-02/reviews/management-R0004/DECISION.md::#adoption",
        "daowei2026/observe-iterate@4a4c8d9e1a6dd7726ed2147b49313c3fa17729c2:runs/BI-01-V2-02/reviews/management-R0001/READER_TASK.md::#question-work-binding"
      ],
      "delivery_scope_ref": "#delivery-scope"
    }
  }
}
