{
  "schema": "longrun-return/v1",
  "work_id": "BI-01",
  "invocation_id": "BI01-FO-01-R0011-20261022T145041Z-c822c94f",
  "assignment_token": "BI01-FO-01-N-NOTEBOOK-PLATFORM-7597f171450b4ee0bb69391af4e0a637",
  "question_work_ref": "#question-work-return",
  "work_status": "IN_PROGRESS",
  "completed_scope_ref": "daowei2026/observe-iterate@a2c9f9333c6578b8bf1dd26fb589b1a6b2956ae9:runs/BI-01-FO-01/artifacts/professional-R0011/FULL_RESPONSE.md#completed",
  "remaining_scope_ref": "daowei2026/observe-iterate@a2c9f9333c6578b8bf1dd26fb589b1a6b2956ae9:runs/BI-01-FO-01/artifacts/professional-R0011/FULL_RESPONSE.md#continuation",
  "artifact_refs": [
    {
      "repo": "daowei2026/observe-iterate",
      "commit": "a2c9f9333c6578b8bf1dd26fb589b1a6b2956ae9",
      "path": "runs/BI-01-FO-01/artifacts/professional-R0011/FULL_RESPONSE.md"
    },
    {
      "repo": "daowei2026/observe-iterate",
      "commit": "a2c9f9333c6578b8bf1dd26fb589b1a6b2956ae9",
      "path": "runs/BI-01-FO-01/artifacts/professional-R0011/DISPLAY_PLAN.json"
    },
    {
      "repo": "daowei2026/observe-iterate",
      "commit": "a2c9f9333c6578b8bf1dd26fb589b1a6b2956ae9",
      "path": "runs/BI-01-FO-01/artifacts/professional-R0011/N_observation_R0011.ipynb"
    },
    {
      "repo": "daowei2026/observe-iterate",
      "commit": "a2c9f9333c6578b8bf1dd26fb589b1a6b2956ae9",
      "path": "runs/BI-01-FO-01/artifacts/professional-R0011/WORKER_ORDER.md"
    },
    {
      "repo": "daowei2026/observe-iterate",
      "commit": "a2c9f9333c6578b8bf1dd26fb589b1a6b2956ae9",
      "path": "runs/BI-01-FO-01/artifacts/professional-R0011/verify_r0011.py"
    },
    {
      "repo": "daowei2026/observe-iterate",
      "commit": "a2c9f9333c6578b8bf1dd26fb589b1a6b2956ae9",
      "path": "runs/BI-01-FO-01/artifacts/professional-R0011/CHECK_RESULTS.json"
    }
  ],
  "delivery": {
    "status": "READY",
    "missing_refs": []
  },
  "materials": {
    "use_record_ref": "daowei2026/observe-iterate@a2c9f9333c6578b8bf1dd26fb589b1a6b2956ae9:runs/BI-01-FO-01/artifacts/professional-R0011/FULL_RESPONSE.md#source-use",
    "unread_required": [],
    "unavailable_required": [
      "本Pro未取得现场mquant/Uplot/aidata运行环境及Jupyter前端访问；Notebook仅真实执行依赖预检并失败，尚无新图/交互。",
      "本Pro未取得正常Trier/CAE平台执行及浏览器访问；三个公开入口未调用，无本轮report_url或同节点board交付。"
    ]
  },
  "handoff": {
    "kind": "CONTINUE",
    "route_key": "same_work",
    "instructions_ref": "daowei2026/observe-iterate@a2c9f9333c6578b8bf1dd26fb589b1a6b2956ae9:runs/BI-01-FO-01/artifacts/professional-R0011/FULL_RESPONSE.md#continuation"
  },
  "role_outputs": {
    "professional": {
      "mode": "FEATURE_OBSERVATION",
      "result_ref": "daowei2026/observe-iterate@a2c9f9333c6578b8bf1dd26fb589b1a6b2956ae9:runs/BI-01-FO-01/artifacts/professional-R0011/FULL_RESPONSE.md#result",
      "continuation_ref": "daowei2026/observe-iterate@a2c9f9333c6578b8bf1dd26fb589b1a6b2956ae9:runs/BI-01-FO-01/artifacts/professional-R0011/FULL_RESPONSE.md#continuation"
    }
  }
}
