{
  "schema": "longrun-return/v1",
  "work_id": "BI-01",
  "invocation_id": "BI01-CO-01-R0016-492ae29a77",
  "assignment_token": "e314e8c863bf835c818223030041a2f3",
  "question_work_ref": "github:daowei2026/observe-iterate@937fd5c50b6e249b7ca04936f8049ed247090ad1:runs/BI-01-CO-01/provenance/turns/R0016/QUESTION_WORK_RETURN.json::full",
  "work_status": "SUBMITTED",
  "completed_scope_ref": "github:daowei2026/observe-iterate@bfbc5fd41b29299394e16265996589c0b69c26e5:runs/BI-01-CO-01/provenance/turns/R0016/FULL_RESPONSE.md::#completed",
  "remaining_scope_ref": "github:daowei2026/observe-iterate@bfbc5fd41b29299394e16265996589c0b69c26e5:runs/BI-01-CO-01/provenance/turns/R0016/FULL_RESPONSE.md::#remaining",
  "artifact_refs": [
    {
      "repo": "daowei2026/observe-iterate",
      "commit": "bfbc5fd41b29299394e16265996589c0b69c26e5",
      "path": "runs/BI-01-CO-01/provenance/turns/R0016/FULL_RESPONSE.md"
    },
    {
      "repo": "daowei2026/observe-iterate",
      "commit": "b6caf1cd8753c76285a9ffda2a5f3676794e4dc8",
      "path": "runs/BI-01-CO-01/reviews/management-R0016/DECISION.md"
    },
    {
      "repo": "daowei2026/observe-iterate",
      "commit": "b3cc11bc64ea6dd5648fd93e83b03292c11339e5",
      "path": "runs/BI-01-CO-01/01_当前任务.md"
    },
    {
      "repo": "daowei2026/observe-iterate",
      "commit": "ad0b908927765c3b861058a1b8879833577e2192",
      "path": "runs/BI-01-CO-01/README.md"
    },
    {
      "repo": "daowei2026/observe-iterate",
      "commit": "ad0b908927765c3b861058a1b8879833577e2192",
      "path": "runs/BI-01-CO-01/00_长程推进地图.md"
    },
    {
      "repo": "daowei2026/observe-iterate",
      "commit": "ad0b908927765c3b861058a1b8879833577e2192",
      "path": "runtime/config/WORKMAP_BINDING.json"
    },
    {
      "repo": "daowei2026/observe-iterate",
      "commit": "937fd5c50b6e249b7ca04936f8049ed247090ad1",
      "path": "runs/BI-01-CO-01/provenance/turns/R0016/QUESTION_WORK_RETURN.json"
    }
  ],
  "delivery": {
    "status": "READY",
    "missing_refs": []
  },
  "materials": {
    "use_record_ref": "github:daowei2026/observe-iterate@bfbc5fd41b29299394e16265996589c0b69c26e5:runs/BI-01-CO-01/provenance/turns/R0016/FULL_RESPONSE.md::#material-use",
    "unread_required": [],
    "unavailable_required": []
  },
  "handoff": {
    "kind": "SUBMIT",
    "route_key": "decide",
    "instructions_ref": "github:daowei2026/observe-iterate@bfbc5fd41b29299394e16265996589c0b69c26e5:runs/BI-01-CO-01/provenance/turns/R0016/FULL_RESPONSE.md::#continuation"
  },
  "role_outputs": {
    "management": {
      "decision_ref": "github:daowei2026/observe-iterate@b6caf1cd8753c76285a9ffda2a5f3676794e4dc8:runs/BI-01-CO-01/reviews/management-R0016/DECISION.md::#decision",
      "plan_ref": "github:daowei2026/observe-iterate@b6caf1cd8753c76285a9ffda2a5f3676794e4dc8:runs/BI-01-CO-01/reviews/management-R0016/DECISION.md::#plan",
      "issued_work_refs": [
        "github:daowei2026/observe-iterate@b3cc11bc64ea6dd5648fd93e83b03292c11339e5:runs/BI-01-CO-01/01_当前任务.md::full"
      ],
      "delivery_scope_ref": "github:daowei2026/observe-iterate@b6caf1cd8753c76285a9ffda2a5f3676794e4dc8:runs/BI-01-CO-01/reviews/management-R0016/DECISION.md::#delivery-scope"
    }
  }
}
