{
  "schema": "longrun-return/v1",
  "work_id": "BI-01",
  "invocation_id": "BI01-CO-01-R0014-8ac6dc37c1",
  "assignment_token": "d9579e5decbde04217f3a3169bd64d57",
  "question_work_ref": "github:daowei2026/observe-iterate@92066d2ae6494a3d1a1c63bc4787980720414d7a:runs/BI-01-CO-01/provenance/turns/R0014/QUESTION_WORK_RETURN.json::full",
  "work_status": "SUBMITTED",
  "completed_scope_ref": "github:daowei2026/observe-iterate@673b38e19e9e009c34d7f44c5163e53a11fd1b4f:runs/BI-01-CO-01/provenance/turns/R0014/FULL_RESPONSE.md::#completed",
  "remaining_scope_ref": "github:daowei2026/observe-iterate@673b38e19e9e009c34d7f44c5163e53a11fd1b4f:runs/BI-01-CO-01/provenance/turns/R0014/FULL_RESPONSE.md::#remaining",
  "artifact_refs": [
    {
      "repo": "daowei2026/observe-iterate",
      "commit": "673b38e19e9e009c34d7f44c5163e53a11fd1b4f",
      "path": "runs/BI-01-CO-01/provenance/turns/R0014/FULL_RESPONSE.md"
    },
    {
      "repo": "daowei2026/observe-iterate",
      "commit": "cc671a273b507b5f4e2db06779f38b54a712ea43",
      "path": "runs/BI-01-CO-01/reviews/management-R0014/DECISION.md"
    },
    {
      "repo": "daowei2026/observe-iterate",
      "commit": "f0868dea76dabf61e74520e1f9bc3e7676705e99",
      "path": "runs/BI-01-CO-01/README.md"
    },
    {
      "repo": "daowei2026/observe-iterate",
      "commit": "f0868dea76dabf61e74520e1f9bc3e7676705e99",
      "path": "runs/BI-01-CO-01/00_长程推进地图.md"
    },
    {
      "repo": "daowei2026/observe-iterate",
      "commit": "f0868dea76dabf61e74520e1f9bc3e7676705e99",
      "path": "runtime/config/WORKMAP_BINDING.json"
    },
    {
      "repo": "daowei2026/observe-iterate",
      "commit": "da7f038e97e5ba9639886ed0a6e146ad59912d15",
      "path": "runs/BI-01-CO-01/01_当前任务.md"
    },
    {
      "repo": "daowei2026/observe-iterate",
      "commit": "92066d2ae6494a3d1a1c63bc4787980720414d7a",
      "path": "runs/BI-01-CO-01/provenance/turns/R0014/QUESTION_WORK_RETURN.json"
    }
  ],
  "delivery": {
    "status": "READY",
    "missing_refs": []
  },
  "materials": {
    "use_record_ref": "github:daowei2026/observe-iterate@673b38e19e9e009c34d7f44c5163e53a11fd1b4f:runs/BI-01-CO-01/provenance/turns/R0014/FULL_RESPONSE.md::#material-use",
    "unread_required": [],
    "unavailable_required": []
  },
  "handoff": {
    "kind": "SUBMIT",
    "route_key": "trigger:CO01-EFFORT-REVIEW",
    "instructions_ref": "github:daowei2026/observe-iterate@673b38e19e9e009c34d7f44c5163e53a11fd1b4f:runs/BI-01-CO-01/provenance/turns/R0014/FULL_RESPONSE.md::#continuation"
  },
  "role_outputs": {
    "management": {
      "decision_ref": "github:daowei2026/observe-iterate@cc671a273b507b5f4e2db06779f38b54a712ea43:runs/BI-01-CO-01/reviews/management-R0014/DECISION.md::#decision",
      "plan_ref": "github:daowei2026/observe-iterate@cc671a273b507b5f4e2db06779f38b54a712ea43:runs/BI-01-CO-01/reviews/management-R0014/DECISION.md::#plan",
      "issued_work_refs": [
        "github:daowei2026/observe-iterate@da7f038e97e5ba9639886ed0a6e146ad59912d15:runs/BI-01-CO-01/01_当前任务.md::full"
      ],
      "delivery_scope_ref": "github:daowei2026/observe-iterate@cc671a273b507b5f4e2db06779f38b54a712ea43:runs/BI-01-CO-01/reviews/management-R0014/DECISION.md::#delivery-scope"
    }
  }
}
