{
  "schema":"longrun-return/v1",
  "work_id":"BI-01",
  "invocation_id":"BI01-V2-01-R0007-3bdb415f96a3601e4bec2f8f",
  "assignment_token":"3b195fdc03bd6d30fe51362b9868f0",
  "question_work_ref":"#question-work-return",
  "work_status":"SUBMITTED",
  "completed_scope_ref":"#completed",
  "remaining_scope_ref":"#remaining",
  "artifact_refs":[{"answer_ref":"#artifacts"},{"answer_ref":"#reception"},{"answer_ref":"#findings"},{"answer_ref":"#adoption"}],
  "delivery":{"status":"READY","missing_refs":[]},
  "materials":{"use_record_ref":"#materials","unread_required":[],"unavailable_required":[]},
  "handoff":{"kind":"SUBMIT","route_key":"same_work","instructions_ref":"#continuation"},
  "role_outputs":{"management":{
    "decision_ref":"#reception",
    "plan_ref":"#plan",
    "issued_work_refs":["github:daowei2026/observe-iterate@81533abbced55b3af14a428dec9cbf8353fc8286:runs/BI-01-V2-01/01_当前任务.md::L124-L177","#continuation"],
    "delivery_scope_ref":"#delivery-scope"
  }}
}
