{
  "schema": "longrun-return/v1",
  "work_id": "BI-01",
  "invocation_id": "BI01-V2-02-R0008-20261018T171352Z-8b01a7dd",
  "assignment_token": "BI01-V2-02-MRECEPTION-566c2a19459a469d9aefa66792533296",
  "question_work_ref": "#question-work-return",
  "work_status": "SUBMITTED",
  "completed_scope_ref": "#completed",
  "remaining_scope_ref": "#remaining",
  "artifact_refs": [
    {
      "repo": "daowei2026/observe-iterate",
      "commit": "5448c367072519bbce3542e4fb35b22ff0af79eb",
      "path": "runs/BI-01-V2-02/reviews/management-R0008/DECISION.md"
    },
    {
      "repo": "daowei2026/observe-iterate",
      "commit": "d364dd880434ca2f94b5b1ffa87b3c3c5e71ab23",
      "path": "runs/BI-01-V2-02/provenance/turns/R0007/QUESTION_WORK_RETURN.json"
    },
    {
      "repo": "daowei2026/observe-iterate",
      "commit": "440562023cf02a9f208a9c74efbb800c631b610a",
      "path": "runs/BI-01-V2-02/reviews/WORKMAP_INTAKE_CURRENT.json"
    },
    {
      "repo": "daowei2026/observe-iterate",
      "commit": "1f0128e3c272d6f9c59f6e5f490b64adb407409e",
      "path": "runs/BI-01-V2-02/PROGRESS.md"
    },
    {
      "repo": "daowei2026/observe-iterate",
      "commit": "79d4267df7f737e438ef754b801004e593c54ed1",
      "path": "runs/BI-01-V2-02/provenance/turns/R0008/FULL_RESPONSE.md"
    },
    {
      "repo": "daowei2026/observe-iterate",
      "commit": "19ef56db70addb71b2d29647bf93b56675f30370",
      "path": "runs/BI-01-V2-02/artifacts/worker-R0006/WORKER_RETURN.md"
    },
    {
      "repo": "daowei2026/observe-iterate",
      "commit": "3584306a6c5ce0e563434788cf9a40066b27ce40",
      "path": "runs/BI-01-V2-02/reviews/management-R0008/WORKMAP_GATE_RETURN.json"
    }
  ],
  "delivery": {
    "status": "READY",
    "missing_refs": []
  },
  "materials": {
    "use_record_ref": "#material-use",
    "unread_required": [],
    "unavailable_required": []
  },
  "handoff": {
    "kind": "SUBMIT",
    "route_key": "return_to_ref",
    "instructions_ref": "#continuation"
  },
  "role_outputs": {
    "management": {
      "decision_ref": "#management-decision",
      "plan_ref": "#plan",
      "issued_work_refs": [
        "daowei2026/observe-iterate@5448c367072519bbce3542e4fb35b22ff0af79eb:runs/BI-01-V2-02/reviews/management-R0008/DECISION.md::#adoption",
        "daowei2026/observe-iterate@5448c367072519bbce3542e4fb35b22ff0af79eb:runs/BI-01-V2-02/reviews/management-R0008/DECISION.md::#continuation",
        "daowei2026/observe-iterate@440562023cf02a9f208a9c74efbb800c631b610a:runs/BI-01-V2-02/reviews/WORKMAP_INTAKE_CURRENT.json::full"
      ],
      "delivery_scope_ref": "#delivery-scope"
    }
  }
}
