{
  "schema": "longrun-return/v1",
  "work_id": "BI-01",
  "invocation_id": "BI01-FO-01-R0007-20261022T081903Z-a9efdb6a",
  "assignment_token": "BI01-FO-01-N-OWNER-CORRECTION-0b65aeb5a3834499a24640864d0f1d3f",
  "question_work_ref": "#question-work-return",
  "work_status": "IN_PROGRESS",
  "completed_scope_ref": "daowei2026/observe-iterate@606d7ffcb75f7f5e896a187c366bfe1f4d1d4ffa:runs/BI-01-FO-01/artifacts/professional-R0007/FULL_RESPONSE.md#completed",
  "remaining_scope_ref": "daowei2026/observe-iterate@606d7ffcb75f7f5e896a187c366bfe1f4d1d4ffa:runs/BI-01-FO-01/artifacts/professional-R0007/FULL_RESPONSE.md#continuation",
  "artifact_refs": [
    {
      "repo": "daowei2026/observe-iterate",
      "commit": "606d7ffcb75f7f5e896a187c366bfe1f4d1d4ffa",
      "path": "runs/BI-01-FO-01/artifacts/professional-R0007/FULL_RESPONSE.md"
    },
    {
      "repo": "daowei2026/observe-iterate",
      "commit": "606d7ffcb75f7f5e896a187c366bfe1f4d1d4ffa",
      "path": "runs/BI-01-FO-01/artifacts/professional-R0007/u2_normal_node_behavior.py"
    },
    {
      "repo": "daowei2026/observe-iterate",
      "commit": "606d7ffcb75f7f5e896a187c366bfe1f4d1d4ffa",
      "path": "runs/BI-01-FO-01/artifacts/professional-R0007/WORKER_ORDER.md"
    },
    {
      "repo": "daowei2026/observe-iterate",
      "commit": "606d7ffcb75f7f5e896a187c366bfe1f4d1d4ffa",
      "path": "runs/BI-01-FO-01/artifacts/professional-R0007/verify_r0007.py"
    },
    {
      "repo": "daowei2026/observe-iterate",
      "commit": "606d7ffcb75f7f5e896a187c366bfe1f4d1d4ffa",
      "path": "runs/BI-01-FO-01/artifacts/professional-R0007/CHECK_RESULTS.json"
    }
  ],
  "delivery": {
    "status": "READY",
    "missing_refs": []
  },
  "materials": {
    "use_record_ref": "daowei2026/observe-iterate@606d7ffcb75f7f5e896a187c366bfe1f4d1d4ffa:runs/BI-01-FO-01/artifacts/professional-R0007/FULL_RESPONSE.md#source-use",
    "unread_required": [],
    "unavailable_required": [
      "daowei2026/aidata@f58ea95c358b9ac31659c92b7bc20fe9bf7f8264:README.md"
    ]
  },
  "handoff": {
    "kind": "CONTINUE",
    "route_key": "same_work",
    "instructions_ref": "daowei2026/observe-iterate@606d7ffcb75f7f5e896a187c366bfe1f4d1d4ffa:runs/BI-01-FO-01/artifacts/professional-R0007/FULL_RESPONSE.md#continuation"
  },
  "role_outputs": {
    "professional": {
      "mode": "FEATURE_OBSERVATION",
      "result_ref": "daowei2026/observe-iterate@606d7ffcb75f7f5e896a187c366bfe1f4d1d4ffa:runs/BI-01-FO-01/artifacts/professional-R0007/FULL_RESPONSE.md#result",
      "continuation_ref": "daowei2026/observe-iterate@606d7ffcb75f7f5e896a187c366bfe1f4d1d4ffa:runs/BI-01-FO-01/artifacts/professional-R0007/FULL_RESPONSE.md#continuation"
    }
  }
}
