{
  "schema": "longrun-return/v1",
  "work_id": "BI-01",
  "invocation_id": "BI01-FO-01-R0043-20261025T034044Z-069dcd6f",
  "assignment_token": "BI01-FO-01-M-ACCEPT-EFFORT18-5f89837f5a134df698ca7ae43b92de6a",
  "question_work_ref": "github:daowei2026/observe-iterate@8280c03e5da23cf99030f98305dbc9d30758ab51:runs/BI-01-FO-01/reviews/management-R0043/QUESTION_WORK_RETURN.json::full",
  "work_status": "WAITING_INPUT",
  "completed_scope_ref": "github:daowei2026/observe-iterate@076a43710fe275dfa061439d928fd9bffbe8484b:runs/BI-01-FO-01/reviews/management-R0043/FULL_RESPONSE.md::#completed",
  "remaining_scope_ref": "github:daowei2026/observe-iterate@076a43710fe275dfa061439d928fd9bffbe8484b:runs/BI-01-FO-01/reviews/management-R0043/FULL_RESPONSE.md::#continuation",
  "artifact_refs": [
    {
      "repo": "daowei2026/observe-iterate",
      "commit": "076a43710fe275dfa061439d928fd9bffbe8484b",
      "path": "runs/BI-01-FO-01/reviews/management-R0043/FULL_RESPONSE.md"
    },
    {
      "repo": "daowei2026/observe-iterate",
      "commit": "6724fe48d2276cc156cc864eb47ed51fd4d382c2",
      "path": "runtime/config/WORKMAP_BINDING.json"
    },
    {
      "repo": "daowei2026/observe-iterate",
      "commit": "8280c03e5da23cf99030f98305dbc9d30758ab51",
      "path": "runs/BI-01-FO-01/reviews/management-R0043/QUESTION_WORK_RETURN.json"
    }
  ],
  "delivery": {
    "status": "READY",
    "missing_refs": []
  },
  "materials": {
    "use_record_ref": "github:daowei2026/observe-iterate@076a43710fe275dfa061439d928fd9bffbe8484b:runs/BI-01-FO-01/reviews/management-R0043/FULL_RESPONSE.md::#source-use",
    "unread_required": [],
    "unavailable_required": []
  },
  "handoff": {
    "kind": "WAIT",
    "route_key": "same_work",
    "instructions_ref": "github:daowei2026/observe-iterate@076a43710fe275dfa061439d928fd9bffbe8484b:runs/BI-01-FO-01/reviews/management-R0043/FULL_RESPONSE.md::#continuation"
  },
  "role_outputs": {
    "management": {
      "decision_ref": "github:daowei2026/observe-iterate@076a43710fe275dfa061439d928fd9bffbe8484b:runs/BI-01-FO-01/reviews/management-R0043/FULL_RESPONSE.md::#decision",
      "plan_ref": "github:daowei2026/observe-iterate@076a43710fe275dfa061439d928fd9bffbe8484b:runs/BI-01-FO-01/reviews/management-R0043/FULL_RESPONSE.md::#plan",
      "issued_work_refs": [
        "github:daowei2026/observe-iterate@78cc9a813777b9996d365f8242fc6ca318066972:runs/BI-01-FO-01/01_当前任务.md::full",
        "github:daowei2026/observe-iterate@076a43710fe275dfa061439d928fd9bffbe8484b:runs/BI-01-FO-01/reviews/management-R0043/FULL_RESPONSE.md::#owner-delta",
        "github:daowei2026/observe-iterate@076a43710fe275dfa061439d928fd9bffbe8484b:runs/BI-01-FO-01/reviews/management-R0043/FULL_RESPONSE.md::#next-professional"
      ],
      "delivery_scope_ref": "github:daowei2026/observe-iterate@076a43710fe275dfa061439d928fd9bffbe8484b:runs/BI-01-FO-01/reviews/management-R0043/FULL_RESPONSE.md::#completed"
    }
  }
}
